{
  "id": "sec-S3Z17-kDEc2A9A92Y0bqi",
  "title": "Tool Qualification Guidance (DO-330)",
  "defs": [],
  "children": [
    {
      "id": "sub-05g32laS1cijWsUXDSXDF",
      "title": "Tool Qualification Levels (TQL)",
      "defs": [],
      "content": [
        {
          "type": "paragraph",
          "text": "DO-330 defines Tool Qualification Levels based on tool impact:"
        },
        {
          "type": "paragraph",
          "text": "**Definition 18.1 (Tool Categories)**"
        },
        {
          "type": "definition-list",
          "items": [
            {
              "term": "CRITERIA 1",
              "definition": "Tool output is part of airborne software. Output directly becomes part of the certified system. Example: Code generator"
            },
            {
              "term": "CRITERIA 2",
              "definition": "Tool automates verification AND could fail to detect error. Tool replaces human verification activity. False negative possible (miss a defect). Example: Static analyzer, test coverage tool"
            },
            {
              "term": "CRITERIA 3",
              "definition": "Tool automates verification AND cannot fail to detect error. Tool output verified by other means. Example: Test execution framework with manual review"
            }
          ]
        },
        {
          "type": "paragraph",
          "text": "**Definition 18.2 (Tool Qualification Level)**"
        },
        {
          "type": "table",
          "columns": [
            "Criteria Met",
            "DAL A",
            "DAL B",
            "DAL C",
            "DAL D"
          ],
          "rows": [
            [
              "1",
              "TQL-1",
              "TQL-2",
              "TQL-3",
              "TQL-4"
            ],
            [
              "2",
              "TQL-4",
              "TQL-4",
              "TQL-5",
              "TQL-5"
            ],
            [
              "3",
              "TQL-5",
              "TQL-5",
              "TQL-5",
              "TQL-5"
            ]
          ]
        },
        {
          "type": "paragraph",
          "text": "TQL Effort:\n  TQL-1: Highest (equivalent to DAL-A software)\n  TQL-2: High (equivalent to DAL-B software)\n  TQL-3: Medium (equivalent to DAL-C software)\n  TQL-4: Low (equivalent to DAL-D software)\n  TQL-5: Lowest (operational history may suffice)"
        }
      ],
      "suffix": "1"
    },
    {
      "id": "sub-OPqimZTNjywqzQRltEcrn",
      "title": "STRATUM Tool Classification",
      "defs": [],
      "content": [
        {
          "type": "paragraph",
          "text": "STRATUM tools are classified as follows:"
        },
        {
          "type": "table",
          "columns": [
            "STRATUM Component",
            "Criteria",
            "TQL (DAL-A)",
            "Rationale"
          ],
          "rows": [
            [
              "Specification Store",
              "1",
              "TQL-1",
              "Stores certified reqs"
            ],
            [
              "RTM Generator",
              "2",
              "TQL-4",
              "Could miss trace gaps"
            ],
            [
              "Constraint Validator",
              "2",
              "TQL-4",
              "Could miss violations"
            ],
            [
              "Impact Analyzer",
              "2",
              "TQL-4",
              "Could miss dependencies"
            ],
            [
              "Checklist Generator",
              "3",
              "TQL-5",
              "Human reviews output"
            ],
            [
              "Visualization",
              "3",
              "TQL-5",
              "No certification impact"
            ]
          ]
        },
        {
          "type": "paragraph",
          "text": "**Definition 18.3 (Tool Operational Requirements)**"
        },
        {
          "type": "paragraph",
          "text": "For TQL-1 (Specification Store):"
        },
        {
          "type": "checklist",
          "label": "1. TOOL REQUIREMENTS (DO-330 referenceMap(\"sub-K1-qOmCVrnDqLrLgOd_aa\", \"§{{sectionNumber}}.2 Completeness\"))",
          "items": [
            "Functional requirements documented",
            "Performance requirements documented",
            "Interface requirements documented",
            "Safety requirements derived from system"
          ]
        },
        {
          "type": "checklist",
          "label": "2. TOOL DESIGN (DO-330 referenceMap(\"sub-sbASI3HUkg21rQji8CA3y\", \"§{{sectionNumber}}.3 Consistency\"))",
          "items": [
            "Architecture documented",
            "Low-level design documented",
            "Design traceable to requirements"
          ]
        },
        {
          "type": "checklist",
          "label": "3. TOOL VERIFICATION (DO-330 referenceMap(\"sub-PNmArYZo6xNqQZsWMEHGT\", \"§{{sectionNumber}}.4 Groundedness\"))",
          "items": [
            "Reviews per requirements",
            "Test cases traceable to requirements",
            "MC/DC coverage for DAL-A equivalent",
            "Robustness testing (invalid inputs)"
          ]
        },
        {
          "type": "checklist",
          "label": "4. TOOL QUALIFICATION DATA (DO-330 referenceMap(\"sub-XWHt4rvXeJPsjryeyJk-f\", \"§{{sectionNumber}}.5 Determinism\"))",
          "items": [
            "Tool Qualification Plan",
            "Tool Requirements",
            "Tool Design Description",
            "Tool Verification Cases and Procedures",
            "Tool Verification Results",
            "Tool Configuration Index",
            "Tool Accomplishment Summary"
          ]
        }
      ],
      "suffix": "2"
    },
    {
      "id": "sub-3ouo4JoVoRarVNYKcH0cC",
      "title": "Qualification Evidence Templates",
      "defs": [],
      "content": [
        {
          "type": "paragraph",
          "text": "Tool Qualification Plan Template:"
        },
        {
          "type": "code",
          "lines": [
            "1. INTRODUCTION",
            "   1.1 Purpose",
            "   1.2 Scope",
            "   1.3 Tool Identification (name, version, vendor)",
            "",
            "2. TOOL OVERVIEW",
            "   2.1 Tool Function",
            "   2.2 Tool Category (Criteria 1/2/3)",
            "   2.3 Tool Qualification Level",
            "   2.4 Justification",
            "",
            "3. QUALIFICATION ACTIVITIES",
            "   3.1 Requirements Activities",
            "   3.2 Design Activities (if TQL-1/2/3)",
            "   3.3 Verification Activities",
            "   3.4 Configuration Management",
            "",
            "4. QUALIFICATION DELIVERABLES",
            "   4.1 Document List",
            "   4.2 Delivery Schedule",
            "",
            "5. REFERENCES",
            "   5.1 DO-330 Section References",
            "   5.2 Project Standards"
          ]
        }
      ],
      "suffix": "3"
    }
  ]
}
